{
  "$schema": "https://json-schema.org/draft/2020-12/schema",
  "type": "object",
  "properties": {
    "protocolVersion": {
      "type": "string",
      "const": "0.4"
    },
    "id": {
      "$ref": "#/$defs/__schema0"
    },
    "ownerId": {
      "$ref": "#/$defs/__schema0"
    },
    "attemptId": {
      "$ref": "#/$defs/__schema0"
    },
    "leaseId": {
      "$ref": "#/$defs/__schema0"
    },
    "fencingGeneration": {
      "type": "integer",
      "exclusiveMinimum": 0,
      "maximum": 9007199254740991
    },
    "cancellationGeneration": {
      "type": "integer",
      "minimum": 0,
      "maximum": 9007199254740991
    },
    "state": {
      "type": "string",
      "enum": [
        "running",
        "cancelled",
        "settled",
        "failed",
        "indeterminate"
      ]
    },
    "basisObservationIds": {
      "maxItems": 64,
      "type": "array",
      "items": {
        "$ref": "#/$defs/__schema0"
      }
    },
    "checkedAt": {
      "type": "string",
      "format": "date-time",
      "pattern": "^(?:(?:\\d\\d[2468][048]|\\d\\d[13579][26]|\\d\\d0[48]|[02468][048]00|[13579][26]00)-02-29|\\d{4}-(?:(?:0[13578]|1[02])-(?:0[1-9]|[12]\\d|3[01])|(?:0[469]|11)-(?:0[1-9]|[12]\\d|30)|(?:02)-(?:0[1-9]|1\\d|2[0-8])))T(?:(?:[01]\\d|2[0-3]):[0-5]\\d(?::[0-5]\\d(?:\\.\\d+)?)?(?:Z|([+-](?:[01]\\d|2[0-3]):[0-5]\\d)))$"
    }
  },
  "required": [
    "protocolVersion",
    "id",
    "ownerId",
    "attemptId",
    "leaseId",
    "fencingGeneration",
    "cancellationGeneration",
    "state",
    "basisObservationIds",
    "checkedAt"
  ],
  "additionalProperties": false,
  "$defs": {
    "__schema0": {
      "type": "string",
      "minLength": 1,
      "maxLength": 128,
      "pattern": "^[A-Za-z0-9][A-Za-z0-9._:-]*$"
    }
  },
  "$id": "urn:waldo:protocol:responsibility-execution:0.4:execution-reconciliation",
  "x-waldo-validation-level": "structural-plus-runtime-invariants"
}
